,Client,Date,Headline,Source,VADER Score,neg,neu,pos
0,NAB,2020-04-30,"Commonwealth Bank home loan, NAB credit card repayment cut sparked by coronavirus may hit borrowers ", ABC News,0.128,0.119,0.734,0.147
1,NAB,2020-04-30,NAB's latest coronavirus hardship measure threatens to hurt customers more than it helps them , Business Insider Australia,-0.6637,0.392,0.473,0.135
2,NAB,2020-04-30,NAB: Coronavirus impact could see house prices drop 30% , Savings.com.au,-0.2732,0.208,0.792,0.0
3,NAB,2020-04-30,Commonwealth Bank home loan repayment cut sparked by coronavirus may hit borrowers , ABC News,-0.2732,0.16,0.84,0.0
4,NAB,2020-04-03,NAB expands coronavirus support to credit card and personal loan customers , Mozo.com.au,0.6908,0.0,0.544,0.456
5,NAB,2020-04-29,"ANZ sets aside $1b for coronavirus recession losses, defers dividend ", ABC News,-0.6705,0.407,0.593,0.0
6,NAB,2020-04-20,NAB flags $1.14bn triple hit to H1 result , The West Australian,0.0,0.0,1.0,0.0
7,NAB,2020-04-17,NAB's McEwan vows fight to save jobs in bank restructure , Sydney Morning Herald,0.1531,0.188,0.58,0.232
8,NAB,2020-04-07,NAB ramps up temporary branch closures , Sydney Morning Herald,0.0,0.0,1.0,0.0
9,NAB,2020-04-30,"Huge coronavirus lift in online gambling, Netflix: NAB ", The Australian,0.3182,0.0,0.753,0.247
10,NAB,2020-04-14,"A huge hit to the business sector from coronavirus, NAB anticipates ", Property Observer,0.3182,0.0,0.796,0.204
11,NAB,2020-04-28,Banks' loan losses could top $35b , The Australian Financial Review,-0.2263,0.318,0.471,0.212
12,NAB,2020-04-02,"Consumer anxiety on the rise as coronavirus impacts economy, NAB survey shows ", Domain News,-0.1779,0.134,0.866,0.0
13,NAB,2020-04-29,"Good, good, good Coronavirus stimulation ", Switzer Financial News,0.8271,0.0,0.187,0.813
14,NAB,2020-04-20,Coronavirus credit card cuts: Which banks have slashed rates? , Mozo.com.au,-0.128,0.323,0.472,0.205
15,NAB,2020-04-27,"Women, over 65s struggling with financial stress due to coronavirus, says NAB ", Savings.com.au,-0.6808,0.359,0.641,0.0
16,NAB,2020-04-30,"ANZ hopes for the best, prepares for the worst ", WAtoday,0.4404,0.24,0.351,0.409
17,NAB,2020-04-24,"NAB Campaign Targets Coronavirus Aid, Federal Ads for Local Stations ", Radio World,0.0,0.0,1.0,0.0
18,NAB,2020-04-28,Indian cops use giant 'tongs' to nab people breaking coronavirus lockdown , New York Post ,0.0,0.0,1.0,0.0
19,NAB,2020-04-14,"ASX lifts, while collapse in business confidence points to 'unprecedented' recession: NAB report ", ABC News,-0.4019,0.311,0.518,0.171
20,NAB,2020-04-28,Westpac raising fears abate as it vows to 'absorb' $2.2b hit , Sydney Morning Herald,-0.4215,0.219,0.781,0.0
21,NAB,2020-04-29,"Markets Live, Wednesday 29 April, 2020 ", The Sydney Morning Herald,0.0,0.0,1.0,0.0
22,NAB,2020-04-03,It’s lonely at the top for NAB boss Ross McEwan as nation locks down , The Australian,-0.1779,0.153,0.736,0.11
23,NAB,2020-04-30,"Half a million go on the dole, jobless rate may remain high for years ", Brisbane Times,0.0,0.0,1.0,0.0
24,NAB,2020-04-20,"ASX drops 2.5pc as oil prices collapse, while NAB flags $1.1b hit to earnings ", ABC News,-0.4939,0.198,0.802,0.0
25,NAB,2020-04-06,"NAB receives 50,000 loan relief requests - The Adviser ", The Adviser,0.4767,0.0,0.693,0.307
26,NAB,2020-04-14,Coronavirus Impacts ING Home Loans: Casuals & Contractors May Not Be Considered , Canstar,0.0,0.0,1.0,0.0
27,NAB,2020-04-03,Coronavirus: What you need to know about credit in a pandemic , The New Daily,0.3818,0.0,0.776,0.224
28,NAB,2020-04-08,"ASX falls as coronavirus rally fades, Dow Jones gives up 900-point surge ", ABC News,0.0,0.0,1.0,0.0
29,NAB,2020-04-30,"Half a million go on the dole, jobless rate could remain high for years ", Sydney Morning Herald,0.0,0.0,1.0,0.0
30,NAB,2020-03-31,Is your money safe in Australian banks during the coronavirus pandemic? , ABC News,0.4404,0.0,0.775,0.225
31,NAB,2020-04-14,Coronavirus support: What the Big Four banks are offering households and businesses , The New Daily,0.4019,0.0,0.803,0.197
32,NAB,2020-04-09,"Australian shares rise, investors buoyed by signs US coronavirus outbreak may be near peak ", ABC News,0.296,0.0,0.855,0.145
33,NAB,2020-04-01,NAB CEO says the bank is doing 'enough at this point in time' , 3AW,0.0,0.0,1.0,0.0
34,NAB,2020-04-28,A Thin Mints bailout? Girl Scouts nab coronavirus relief funds , The Hustle,0.4019,0.122,0.609,0.27
35,NAB,2020-04-24,NAB announces new JobKeeper hotline - 1800 JOB KEEPER , Mirage News,0.0,0.0,1.0,0.0
36,NAB,2020-04-09,"NAB rural commodities index hits new record thanks to rain, low $A ", Farm Weekly,0.2023,0.14,0.667,0.193
37,NAB,2020-04-02,"Banks drag Australian market lower, IMF warns wartime measures are needed due to coronavirus fallout ", ABC News,-0.5423,0.314,0.686,0.0
38,NAB,2020-04-25,Over 225 NAB staff in quarantine after 5 test positive for coronavirus , Nation News,0.5574,0.0,0.735,0.265
39,NAB,2020-04-29,How Northamptonshire blind charity is supporting visually-impaired people during the coronavirus lockdown , Northamptonshire Telegraph,0.4588,0.155,0.517,0.328
40,NAB,2020-04-01,ASX surges as Reserve Bank warns of 'sharp contraction' from coronavirus , ABC News,-0.1027,0.123,0.877,0.0
41,NAB,2020-04-20,NAB and Coronavirus , Pakistan Today,0.0,0.0,1.0,0.0
42,NAB,2020-04-24,Aussie stocks open flat after Wall Street rallies on human trial news , 9News,0.0,0.0,1.0,0.0
43,NAB,2020-04-08,Australian shares slump at opening as big banks dip over dividend concerns , 9News,0.296,0.0,0.833,0.167
44,NAB,2020-04-30,Australian businesses borrow big to weather coronavirus storm , WHBL News,0.0,0.0,1.0,0.0
45,NAB,2020-04-15,NAB business confidence reading falls to a record low of minus 66 following coronavirus shutdowns , Daily Mail,0.296,0.121,0.69,0.19
46,NAB,2020-04-28,ASX dips slightly as oil prices drop again , Yahoo News Australia,-0.2732,0.231,0.769,0.0
47,NAB,2020-04-22,'It's not the NAB': Phil Gould demands NRL's next CEO has rugby league foundations , Sporting News AU,0.0,0.0,1.0,0.0
48,NAB,2020-04-02,Businesses eagerly wait for JobKeeper payments as coronavirus fallout begins to hit incomes , ABC News,0.3818,0.0,0.822,0.178
49,NAB,2020-04-02,Coronavirus: Australian banks face calls to scrap dividends during crisis , The New Daily,-0.6249,0.313,0.687,0.0
50,NAB,2020-04-07,The Aussies suffering the most from isolation anxiety , Daily Telegraph,-0.793,0.617,0.383,0.0
51,NAB,2020-04-10,Why investors are rushing back into the markets despite the coronavirus crisis , The New Daily,0.5096,0.0,0.77,0.23
52,NAB,2020-04-02,"Anxious consumers ripe for change, NAB index finds ", The Australian,-0.25,0.222,0.778,0.0
53,NAB,2020-04-07,"ASX drops as coronavirus hits job market, shrugs off Dow Jones surge ", ABC News,0.0,0.0,1.0,0.0
54,NAB,2020-04-16,Coronavirus Sees CBA Automatically Cut Mortgage Payments to Minimum , Canstar,-0.2732,0.208,0.792,0.0
55,NAB,2020-04-29,Coronavirus: Trump makes new push to expand US testing — as it happened , Financial Times,0.3182,0.0,0.827,0.173
56,NAB,2020-04-28,Covid 19 coronavirus: Rotorua's residents up at 4am to nab level 3 McDonald's fix , New Zealand Herald,0.0,0.0,1.0,0.0
57,NAB,2020-04-27,ASX200 finishes higher as Aussie dollar climbs , Yahoo Finance Australia,0.0,0.0,1.0,0.0
58,NAB,2020-04-02,CommBank offers interest refunds for home loan and credit card customers , Savings.com.au,0.6808,0.0,0.616,0.384
59,NAB,2020-04-06,Australian shares jump 4.3pc on slowing rate of coronavirus infections , ABC News,0.296,0.0,0.804,0.196
60,NAB,2020-04-10,Police pounce on people ignoring COVID-19 travel advice , Tasmania Examiner,-0.4019,0.278,0.722,0.0
61,NAB,2020-04-30,Court seeks progress report on Narowal Sports City scandal , ARY NEWS,-0.0258,0.228,0.551,0.22
62,NAB,2020-04-06,NAB the last of the big four to announce credit card support: Finder.com.au , Property Observer,0.6486,0.0,0.675,0.325
63,NAB,2020-04-06,Businesses can 'tread water' for six months: CBA , Sydney Morning Herald,0.0,0.0,1.0,0.0
64,NAB,2020-04-18,Shehbaz skips NAB hearing due to coronavirus , Daily Times,0.0,0.0,1.0,0.0
65,NAB,2020-03-24,NAB worker sacked over false coronavirus test , The New Daily,0.0,0.0,1.0,0.0
66,NAB,2020-03-17,NAB HQ evacuated after worker contracts coronavirus , The New Daily,0.0,0.0,1.0,0.0
67,NAB,2020-04-06,COVID-19 Home Loan Repayment Help , Canstar,0.4019,0.0,0.597,0.403
68,NAB,2020-04-02,Government extends support to First Home Loan Deposit Scheme applicants amid coronavirus auction ban , Mozo.com.au,-0.1027,0.191,0.585,0.223
69,NAB,2020-04-06,"Less food poisoning, more cybercrime: the unintended consequences of the coronavirus shutdown ", SBS News,-0.5456,0.243,0.757,0.0
70,NAB,2020-03-31,Thieves nab Van Gogh painting from closed museum , The New Daily,-0.5106,0.32,0.68,0.0
71,NAB,2020-04-08,Can You Get Sick With Coronavirus Twice? The Jury Is Still Out , Forbes,-0.5106,0.231,0.769,0.0
72,NAB,2020-03-25,Projects cut at NAB to focus on customer needs during coronavirus crisis , The Australian,-0.7351,0.383,0.617,0.0
73,NAB,2020-04-20,NAB clamps down on serviceability - The Adviser , The Adviser,0.0,0.0,1.0,0.0
74,NAB,2020-04-30,Buying a Car Amid Coronavirus , Savings.com.au,0.0,0.0,1.0,0.0
75,NAB,2020-04-27,NAB: Broadcast Competition Rules Must be Updated , TV Technology,0.0,0.0,1.0,0.0
76,NAB,2020-04-19,Cops enforcing coronavirus restrictions on Florida beach nab fugitive Pennsylvania murder suspect , Fox News,-0.7845,0.408,0.592,0.0
77,NAB,2020-04-09,"Bank dividend cuts were inevitable, with or without APRA's direction ", Sydney Morning Herald,-0.296,0.196,0.804,0.0
78,NAB,2020-04-09,Which ASX 200 shares are investors buying during coronavirus? , Motley Fool Australia,0.296,0.0,0.784,0.216
79,NAB,2020-04-26,Eagles nab Hand-Madison lineman Jack Driscoll in NFL Draft’s 4th round , Hartford Courant,0.0,0.0,1.0,0.0
80,NAB,2020-04-02,Avid Delays NAB News to Concentrate on Pandemic , TV Technology,0.296,0.0,0.761,0.239
81,NAB,2020-04-03,Tap and go payment limit increased to $200 to contain virus spread , Savings.com.au,0.2732,0.0,0.84,0.16
82,NAB,2020-04-27,Coronavirus: The irony for banks as they face pressure over COVID-19 loans , Sky News,-0.34,0.254,0.746,0.0
83,NAB,2020-03-20,Coronavirus: NAB allows homeowners to defer repayments for 6 months , NEWS.com.au,-0.296,0.216,0.784,0.0
84,NAB,2020-04-30,"1,000 first home buyers access First Home Loan Deposit Scheme with Commbank ", Savings.com.au,0.0,0.0,1.0,0.0
85,NAB,2020-04-02,"ASX slides in late trade, banks battered on dividend doubts ", The Sydney Morning Herald,-0.296,0.196,0.804,0.0
86,NAB,2020-03-20,"The big four banks are letting borrowers hit pause on their payments, but this is no mortgage holiday ", ABC News,0.1901,0.125,0.716,0.159
87,NAB,2020-04-14,Coronavirus pandemic: Cop who caught 21 Tablighi attendees in Maharashtra tests positive , MyNation,0.5574,0.0,0.753,0.247
88,NAB,2020-04-28,"Australia permits home visits, opens beaches as coronavirus lockdown eases ", Manila Bulletin,0.3182,0.0,0.796,0.204
89,NAB,2020-04-30,Amsterdam to London Eurostar launch delayed due to coronavirus pandemic , Evening Standard,-0.2263,0.174,0.826,0.0
90,NAB,2020-04-28,Chandigarh Cops Come Up With Brilliant Jugaad To Nab Lockdown Violators While Keeping Distance , India Times,0.2263,0.155,0.642,0.203
91,NAB,2020-04-09,Viewed AFL , AFL,0.0,0.0,1.0,0.0
92,NAB,2020-04-30,NAB Leadership Foundation to Honor Stations' Community Service , Radio World,0.4939,0.0,0.686,0.314
93,NAB,2020-04-29,US Economy Fell 4.8% in Q1 Due to Coronavirus , Media Play News,0.0,0.0,1.0,0.0
94,NAB,2020-04-24,Coronavirus lockdown: CCB sleuths nab two persons selling tobacco products online in Bengaluru , Deccan Herald,0.0,0.0,1.0,0.0
95,NAB,2020-04-08,European cops nab 9 suspects in $100m fraud with ties to Israel's binary options , The Times of Israel,-0.7351,0.36,0.64,0.0
96,NAB,2020-03-17,"Coronavirus cases in Victoria rise, as panic buying hits Melbourne soup kitchens ", ABC News,-0.5106,0.231,0.769,0.0
97,NAB,2020-03-11,NAB reveals the jobs hardest hit by coronavirus outbreak , NEWS.com.au,0.0,0.0,1.0,0.0
98,NAB,2020-04-21,Savers dealt a blow as NAB cuts rates , The Australian,-0.296,0.268,0.732,0.0
99,NAB,2020-03-23,"Coronavirus ASX: Coles, BHP Up, CBA, Westpac, NAB, Afterpay Fall ", Canstar,0.0,0.0,1.0,0.0
0,CBA,2020-04-30,Commonwealth Bank home loan repayment cut sparked by coronavirus may hit borrowers , ABC News,-0.2732,0.16,0.84,0.0
1,CBA,2020-04-30,"Commonwealth Bank home loan, NAB credit card repayment cut sparked by coronavirus may hit borrowers ", ABC News,0.128,0.119,0.734,0.147
2,CBA,2020-04-29,Stimulus payments having 'profound impact' on households amid coronavirus pandemic , ABC News,0.0,0.0,1.0,0.0
3,CBA,2020-04-02,CBA increases coronavirus loan support , Daily Telegraph,0.4019,0.0,0.597,0.403
4,CBA,2020-04-16,Coronavirus Sees CBA Automatically Cut Mortgage Payments to Minimum , Canstar,-0.2732,0.208,0.792,0.0
5,CBA,2020-04-28,"Australians are currently better off under JobSeeker than they were before the coronavirus, according to Commonwealth Bank analysis ", Business Insider Australia,0.4404,0.0,0.854,0.146
6,CBA,2020-04-22,A tale of two pandemics: CBA during coronavirus , Mirage News,0.0,0.0,1.0,0.0
7,CBA,2020-04-29,Why I would buy CBA and these high yield ASX dividend shares , Motley Fool Australia,0.296,0.0,0.82,0.18
8,CBA,2020-04-17,"Sydney, Melbourne house prices facing 10 per cent fall: CBA ", Brisbane Times,0.0,0.0,1.0,0.0
9,CBA,2020-04-06,Businesses can 'tread water' for six months: CBA , Sydney Morning Herald,0.0,0.0,1.0,0.0
10,CBA,2020-04-29,CBA passes First Home Loan Deposit Scheme milestone , Mirage News,0.0,0.0,1.0,0.0
11,CBA,2020-04-15,Hoarding boom is over: CBA says shoppers have closed their wallets , The Age,0.0,0.0,1.0,0.0
12,CBA,2020-04-29,Food security is 'critically important' during crises like the coronavirus , Sky News Australia,0.6908,0.0,0.511,0.489
13,CBA,2020-04-06,CBA approves $150 million in business loans under Coronavirus SME Guarantee Scheme , Mirage News,0.5719,0.0,0.68,0.32
14,CBA,2020-04-28,"Westpac sets aside $3.6b for coronavirus debt and AUSTRAC penalty, Australian shares drop ", ABC News,-0.6597,0.404,0.479,0.117
15,CBA,2020-04-21,Is the CBA share price a buy? , Motley Fool Australia,0.296,0.0,0.694,0.306
16,CBA,2020-04-14,Commbank's benefit finder tool sees spike in demand during coronavirus crisis , Savings.com.au,-0.3818,0.337,0.482,0.181
17,CBA,2020-04-29,"Good, good, good Coronavirus stimulation ", Switzer Financial News,0.8271,0.0,0.187,0.813
18,CBA,2020-04-02,CommBank to stop coronavirus-impacted customers from paying compound interest on loans , Sky News Australia,0.2023,0.155,0.634,0.211
19,CBA,2020-04-14,"Cries for mortgage help 'levelling out', says CBA boss ", Sydney Morning Herald,0.0,0.218,0.565,0.218
20,CBA,2020-04-26,Statement regarding COVIDSafe app , Mirage News,0.0,0.0,1.0,0.0
21,CBA,2020-04-22,"Jeremy Lin, others ‘in limbo’ waiting to see if Chinese Basketball Association restarts ", Yahoo Finance,0.0,0.0,1.0,0.0
22,CBA,2020-04-27,"New South Wales slides and Tasmania surges as state economies reshuffle during the business shutdown, according to a new CBA assessment ", Business Insider Australia,0.0,0.0,1.0,0.0
23,CBA,2020-04-24,"Home buying intentions still near record highs despite pandemic, says CBA ", Savings.com.au,0.0,0.0,1.0,0.0
24,CBA,2020-04-30,Banks: hero or villain of the coronavirus crisis? The customer will decide , The Australian,-0.6249,0.379,0.443,0.177
25,CBA,2020-04-06,COVID-19 Home Loan Repayment Help , Canstar,0.4019,0.0,0.597,0.403
26,CBA,2020-04-21,AFL Players to be surveyed on how footy will be played in 2020 , Fox Sports,0.34,0.0,0.833,0.167
27,CBA,2020-04-29,"Major passes FHB scheme ""milestone"" ", Australian Broker,0.0,0.0,1.0,0.0
28,CBA,2020-04-23,"Australia's economy is reeling from the coronavirus, with the latest temperature check showing the service sector is sinking ", Business Insider Australia,0.0,0.0,1.0,0.0
29,CBA,2020-04-09,Spenders go cashless to curb coronavirus contagion , The Australian,-0.4588,0.333,0.667,0.0
30,CBA,2020-04-14,CBA company executives take pay cut due to coronavirus pandemic - Xinhua | English.news.cn , Xinhua,-0.3612,0.259,0.741,0.0
31,CBA,2020-04-14,Coronavirus support: What the Big Four banks are offering households and businesses , The New Daily,0.4019,0.0,0.803,0.197
32,CBA,2020-04-08,Coronavirus: contaminated money fears push Australia to card payments and cashless shopping , The Guardian,-0.4215,0.203,0.797,0.0
33,CBA,2020-04-20,CBA to move to minimum repayments next week - The Adviser , The Adviser,0.0,0.0,1.0,0.0
34,CBA,2020-04-27,First-home buyers snapping up property with First Home Loan Deposit Scheme despite coronavirus crisis , Domain News,0.5096,0.0,0.798,0.202
35,CBA,2020-04-03,Major to refund interest on deferred repayments , Australian Broker,0.4588,0.0,0.667,0.333
36,CBA,2020-04-06,Battling traders grab $150m from Commonwealth Bank’s virus loan scheme , The West Australian,-0.2732,0.189,0.811,0.0
37,CBA,2020-04-23,Predictions house prices could fall by 30 per cent in worst-case scenario as coronavirus restrictions bite , ABC News,0.0,0.0,1.0,0.0
38,CBA,2020-03-31,Chinese Basketball Association delays season restart due to coronavirus: Could it influence how U.S. sports handle return? , Yahoo Sports,0.0,0.0,1.0,0.0
39,CBA,2020-04-30,NAB's latest coronavirus hardship measure threatens to hurt customers more than it helps them , Business Insider Australia,-0.6637,0.392,0.473,0.135
40,CBA,2020-04-03,375000 join big banks' COVID-19 loan holiday , The Australian Financial Review,0.5994,0.0,0.505,0.495
41,CBA,2020-04-07,Major approves over $150m in SME loans , Australian Broker,0.4019,0.0,0.69,0.31
42,CBA,2020-04-08,Coronavirus is changing the way we bank , The Australian,0.0,0.0,1.0,0.0
43,CBA,2020-03-31,Loo paper hoarding is over - it's time now for a drink and a new home office , The Age,0.0,0.0,1.0,0.0
44,CBA,2020-04-02,More than half a million Aussies to lose jobs: CBA economists , 9News,-0.4019,0.231,0.769,0.0
45,CBA,2020-04-30,ASX rallies to six-week high for best month on record , The Australian,0.6369,0.0,0.682,0.318
46,CBA,2020-04-17,Markets House Prices to Fall 10pc: CBA Ted Tabet 3 Min 16 , The Urban Developer,0.0,0.0,1.0,0.0
47,CBA,2020-04-02,"Banks drag Australian market lower, IMF warns wartime measures are needed due to coronavirus fallout ", ABC News,-0.5423,0.314,0.686,0.0
48,CBA,2020-04-12,Coronavirus: Are the big ASX banks a buy for dividends? , Motley Fool Australia,0.0,0.0,1.0,0.0
49,CBA,2020-04-08,"ASX falls as coronavirus rally fades, Dow Jones gives up 900-point surge ", ABC News,0.0,0.0,1.0,0.0
50,CBA,2020-04-29,Coles revenues soar but bumper sales might not last , The New Daily,0.0,0.0,1.0,0.0
51,CBA,2020-04-09,"Australian shares rise, investors buoyed by signs US coronavirus outbreak may be near peak ", ABC News,0.296,0.0,0.855,0.145
52,CBA,2020-04-06,Should you buy things on a credit card during coronavirus? , Motley Fool Australia,0.3818,0.0,0.755,0.245
53,CBA,2020-04-29,"Coronavirus Australia: WA, NT, ACT economies may recover quicker ", NEWS.com.au,0.0,0.0,1.0,0.0
54,CBA,2020-04-08,Bank dividends could be reduced or on hold during pandemic , Small Caps,0.0,0.0,1.0,0.0
55,CBA,2020-04-06,Australian shares jump 4.3pc on slowing rate of coronavirus infections , ABC News,0.296,0.0,0.804,0.196
56,CBA,2020-04-02,CBA’s Matt Comyn: banks strong enough to keep paying dividends , The Australian,0.5106,0.0,0.732,0.268
57,CBA,2020-04-04,Banks urged to 'stretch' to help crisis customers , The Age,-0.34,0.32,0.469,0.211
58,CBA,2020-04-13,CBA's benefit finder sees surge in demand , Shepparton News,0.3612,0.158,0.526,0.316
59,CBA,2020-04-01,ASX surges as Reserve Bank warns of 'sharp contraction' from coronavirus , ABC News,-0.1027,0.123,0.877,0.0
60,CBA,2020-04-30,Australian businesses borrow big to weather coronavirus storm , WHBL News,0.0,0.0,1.0,0.0
61,CBA,2020-04-30,Borrowing Surge to Ride Out Covid-19 Downturn , The Urban Developer,0.0,0.0,1.0,0.0
62,CBA,2020-04-24,Statement regarding JobKeeper support for small business , Mirage News,0.4019,0.0,0.69,0.31
63,CBA,2020-04-07,"ASX drops as coronavirus hits job market, shrugs off Dow Jones surge ", ABC News,0.0,0.0,1.0,0.0
64,CBA,2020-04-14,Chinese Basketball Association postpones restart until at least July , ESPN Australia,-0.2732,0.208,0.792,0.0
65,CBA,2020-04-29,ASX Close: Coronavirus hopes bring healthy April gains , The Market Herald,0.7845,0.0,0.388,0.612
66,CBA,2020-03-19,Commonwealth Bank boss says the spread of coronavirus will have a worse impact than the global financial crisis , ABC News,-0.802,0.324,0.676,0.0
67,CBA,2020-04-03,Why Commonwealth Bank shares are a no-brainer for income investors , Motley Fool Australia,0.296,0.0,0.784,0.216
68,CBA,2020-04-02,Mastercard ups contactless payment limit to AU$200 , ZDNet,0.0,0.0,1.0,0.0
69,CBA,2020-04-01,"'Don't ask, don't get': Mortgage holders urged to press banks ", 9News,0.0,0.0,1.0,0.0
70,CBA,2020-04-03,How Much Money Will NBA Players Lose Due to Coronavirus Pandemic? , Bleacher Report,-0.4019,0.213,0.787,0.0
71,CBA,2020-04-07,Aussies spending more on DIY during isolation , Savings.com.au,-0.4019,0.31,0.69,0.0
72,CBA,2020-04-15,"Coronavirus has people buying home improvement items over alcohol, data shows ", NEWS.com.au,0.4588,0.0,0.769,0.231
73,CBA,2020-04-20,Coronavirus: There’s nothing to fear from contact-tracing app , The Australian,0.3875,0.0,0.727,0.273
74,CBA,2020-04-10,"Australian stocks rally, CSL’s bullish update and US jobs data ", ig.com,0.0,0.0,1.0,0.0
75,CBA,2020-04-23,Business activity collapses to record low amid calls for reform , The New Daily,-0.5106,0.35,0.65,0.0
76,CBA,2020-04-04,NBA Season Possibly In Jeopardy After Events In China Despite Mark Cuban’s Optimism , Forbes,-0.714,0.351,0.649,0.0
77,CBA,2020-04-01,"ASX 200 lunch update: CBA, Oil Search, & Scentre higher ", Motley Fool Australia,0.0,0.0,1.0,0.0
78,CBA,2020-04-03,Coronavirus sees retail sales rise in February as Australians stockpiled groceries and pharmaceuticals but clothing sales fell , ABC News,0.0,0.0,1.0,0.0
79,CBA,2020-04-06,Camberwell Commonwealth Bank site sold for $12m despite coronavirus , Herald Sun,0.0,0.0,1.0,0.0
80,CBA,2020-04-24,"Westpac freezes credit card charges, suspends landlord insurance sales ", Sydney Morning Herald,0.1027,0.271,0.508,0.22
81,CBA,2020-04-06,The ASX dividend shares to buy during the coronavirus crisis , Motley Fool Australia,-0.4404,0.287,0.559,0.154
82,CBA,2020-04-01,How a recession could impact Australia’s big four banks , ig.com,-0.4215,0.286,0.714,0.0
83,CBA,2020-04-07,'Helicopter money' to households an option to confront coronavirus crisis , ABC Local,-0.7003,0.42,0.58,0.0
84,CBA,2020-04-11,Contactless Payments: Commonwealth Bank of Australia Reports Significant Increase in Digital Wallet Transactions Following COVID-19 Outbreak , Crowdfund Insider,0.4767,0.0,0.773,0.227
85,CBA,2020-04-10,What I look for in dividend shares during coronavirus , Motley Fool Australia,0.296,0.0,0.761,0.239
86,CBA,2020-04-30,'Radical measures' needed to restart UK jury trials , Financial Times,0.0,0.0,1.0,0.0
87,CBA,2020-02-12,Coronavirus spread looms as a risk for Commonwealth Bank as profit falls , ABC News,0.0516,0.253,0.548,0.199
88,CBA,2020-04-01,NRL coronavirus: RLPA and NRL reach agreement on revised pay deal , Sporting News AU,0.4404,0.102,0.584,0.314
89,CBA,2020-04-29,Young bear the brunt of lockdown's financial stress , The Australian Financial Review,-0.4215,0.286,0.714,0.0
90,CBA,2020-04-08,COVID-19 Do Mortgage Repayments Pauses Impact Credit Score? , Canstar,0.3818,0.0,0.729,0.271
91,CBA,2020-04-07,Financial help and advice during the coronavirus outbreak , CHOICE,0.4019,0.0,0.722,0.278
92,CBA,2020-04-30,CBA student launches social media movement to thank heroes , WSYR,0.7003,0.0,0.547,0.453
93,CBA,2020-04-26,"Non-jury trials could help clear coronavirus backlog, says QC ", The Guardian,0.6486,0.0,0.569,0.431
94,CBA,2020-03-31,Weekly survey shows impact of coronavirus | 2020-03-31 , Baking Business,0.0,0.0,1.0,0.0
95,CBA,2020-04-14,"ASX lifts, while collapse in business confidence points to 'unprecedented' recession: NAB report ", ABC News,-0.4019,0.311,0.518,0.171
96,CBA,2020-04-06,High hopes for the future of AFLW - AFL , The Women's Game,0.4215,0.0,0.714,0.286
97,CBA,2020-04-08,How To Start A Major New Asian Basketball League In The Age Of Coronavirus , Forbes,0.0,0.0,1.0,0.0
98,CBA,2020-04-03,Tap and go payment limit increased to $200 to contain virus spread , Savings.com.au,0.2732,0.0,0.84,0.16
99,CBA,2020-04-02,3 dirt cheap ASX dividend shares to buy after the coronavirus crash , Motley Fool Australia,-0.4404,0.333,0.523,0.144
0,ANZ,2020-04-29,ANZ profit tumbles 62% on a $1 billion coronavirus hit , NEWS.com.au,0.4404,0.0,0.734,0.266
1,ANZ,2020-04-30,"ANZ hopes for the best, prepares for the worst ", WAtoday,0.4404,0.24,0.351,0.409
2,ANZ,2020-04-04,'Australia won't look the same': ANZ's Elliott warns coronavirus impact will be generational , The Age,-0.1027,0.104,0.896,0.0
3,ANZ,2020-04-06,ANZ CEO Shayne Elliott answers your banking questions , Herald Sun,0.0,0.0,1.0,0.0
4,ANZ,2020-04-30,"ASX gains in early trade, ANZ and Woolworths slide following updates ", WAtoday,0.34,0.0,0.806,0.194
5,ANZ,2020-04-30,ASX rallies to six-week high for best month on record , The Australian,0.6369,0.0,0.682,0.318
6,ANZ,2020-04-30,"Why ANZ, Northern Star, TPG Telecom, & Woolworths are dropping lower ", Motley Fool Australia,-0.296,0.196,0.804,0.0
7,ANZ,2020-04-30,"US economy suffers worst slump since GFC due to coronavirus, but share markets rally on Fed ", ABC News,-0.2023,0.225,0.637,0.137
8,ANZ,2020-04-28,"Westpac sets aside $3.6b for coronavirus debt and AUSTRAC penalty, Australian shares drop ", ABC News,-0.6597,0.404,0.479,0.117
9,ANZ,2020-04-06,Coronavirus claims Ensemble Travel Group's ANZ business , Travel Weekly,0.0,0.0,1.0,0.0
